{
  "$schema": "https://json-schema.org/draft/2020-12/schema",
  "$id": "https://euclid-min.local/regular-257/final-pair-line-adjacent-search.schema.json",
  "title": "Euclid-Min regular-257 final-pair line adjacency search v1",
  "type": "object",
  "additionalProperties": false,
  "required": [
    "schema",
    "source",
    "semantics",
    "universe",
    "parallelization",
    "search"
  ],
  "properties": {
    "schema": {
      "const": "euclid-min-regular-257-final-pair-line-adjacent-search/v1"
    },
    "source": {
      "type": "object",
      "additionalProperties": false,
      "required": [
        "certificate",
        "certificate_sha256",
        "full_intersection_closure_report",
        "full_intersection_closure_report_sha256",
        "candidate_frontier_report",
        "candidate_frontier_report_sha256"
      ],
      "properties": {
        "certificate": { "const": "construction-69e.json" },
        "certificate_sha256": { "$ref": "#/$defs/sha256" },
        "full_intersection_closure_report": {
          "const": "full-intersection-closure-69e.json"
        },
        "full_intersection_closure_report_sha256": { "$ref": "#/$defs/sha256" },
        "candidate_frontier_report": {
          "const": "full-point-candidate-frontier-69e.json"
        },
        "candidate_frontier_report_sha256": { "$ref": "#/$defs/sha256" }
      }
    },
    "semantics": {
      "type": "object",
      "additionalProperties": false,
      "required": [
        "removed_paid_drawables",
        "candidate_e_move",
        "candidate_family",
        "target_event",
        "limitations"
      ],
      "properties": {
        "removed_paid_drawables": { "const": ["BG0", "target_transfer"] },
        "candidate_e_move": { "const": 68 },
        "candidate_family": {
          "const": "one_line_through_two_available_materialized_exact_points"
        },
        "target_event": {
          "const": "a_new_candidate_intersection_on_c0_is_adjacent_to_an_already_available_point_on_c0"
        },
        "limitations": {
          "type": "array",
          "minItems": 2,
          "maxItems": 2,
          "uniqueItems": true,
          "items": { "type": "string", "minLength": 1 }
        }
      }
    },
    "universe": {
      "type": "object",
      "additionalProperties": false,
      "required": [
        "available_points",
        "available_exact_coordinate_points",
        "existing_target_carriers",
        "line_definitions"
      ],
      "properties": {
        "available_points": { "const": 2103 },
        "available_exact_coordinate_points": { "const": 1759 },
        "existing_target_carriers": { "const": 67 },
        "line_definitions": { "const": 1546161 }
      }
    },
    "parallelization": {
      "type": "object",
      "additionalProperties": false,
      "required": ["workers", "chunk_size", "chunk_count"],
      "properties": {
        "workers": { "const": 8 },
        "chunk_size": { "const": 1000 },
        "chunk_count": { "const": 1547 }
      }
    },
    "search": {
      "type": "object",
      "additionalProperties": false,
      "required": [
        "definitions_tested",
        "ball_relation_checks",
        "ball_excluded_definitions",
        "exact_checks",
        "solutions",
        "solutions_found",
        "status"
      ],
      "properties": {
        "definitions_tested": { "const": 1546161 },
        "ball_relation_checks": { "const": 210277896 },
        "ball_excluded_definitions": { "const": 1546161 },
        "exact_checks": { "const": 0 },
        "solutions": { "type": "array", "maxItems": 0 },
        "solutions_found": { "const": 0 },
        "status": { "const": "exhausted_no_solution" }
      }
    }
  },
  "$defs": {
    "sha256": {
      "type": "string",
      "pattern": "^[0-9a-f]{64}$"
    }
  }
}
