{
  "schema": "euclid-min-regular-257-final-pair-line-adjacent-search/v1",
  "source": {
    "certificate": "construction-69e.json",
    "certificate_sha256": "9b47738d955099547e15369f35cde40fa52c8c5d7594294d372f1ad753c6b10b",
    "full_intersection_closure_report": "full-intersection-closure-69e.json",
    "full_intersection_closure_report_sha256": "c22dc2fec78d560cfd112de01698506ff94e2ecc372897f2c4243cb5c6f28294",
    "candidate_frontier_report": "full-point-candidate-frontier-69e.json",
    "candidate_frontier_report_sha256": "fabd29e6fe05e32b9ec5e102aa67802819a88e060df2be3b5c5ca4f4ed121bf8"
  },
  "semantics": {
    "removed_paid_drawables": [
      "BG0",
      "target_transfer"
    ],
    "candidate_e_move": 68,
    "candidate_family": "one_line_through_two_available_materialized_exact_points",
    "target_event": "a_new_candidate_intersection_on_c0_is_adjacent_to_an_already_available_point_on_c0",
    "limitations": [
      "本报告与目标弦报告合并后才完整覆盖该分片的直线候选。",
      "尚未检查圆候选，也未物化 474 个抽象残余圆交点。"
    ]
  },
  "universe": {
    "available_points": 2103,
    "available_exact_coordinate_points": 1759,
    "existing_target_carriers": 67,
    "line_definitions": 1546161
  },
  "parallelization": {
    "workers": 8,
    "chunk_size": 1000,
    "chunk_count": 1547
  },
  "search": {
    "definitions_tested": 1546161,
    "ball_relation_checks": 210277896,
    "ball_excluded_definitions": 1546161,
    "exact_checks": 0,
    "solutions": [],
    "solutions_found": 0,
    "status": "exhausted_no_solution"
  }
}
